image_file,code,name,material,fragm,description
dataset/Нц-34-079_orig.jpg,Нц-34-079,Изразец,Керамика,Фрагмент,Изразца стенового с белой поливой фрагмент
dataset/БП12-Г01-7212_orig.jpg,БП12-Г01-7212,Изразец,Керамика,Фрагмент,Изразца красноглиняного декорированного фр-т
dataset/Нейш3А-2018-0833_orig.jpg,Нейш3А-2018-0833,Блюдце,Фарфор,Фрагмент,"Блюдца фарфорового с цветочным орнаментом внутри (желтый, зеленый, сиреневый, коричневый, золотистый) профиль"
dataset/Нц-37-0589_orig.jpg,Нц-37-0589,Изразец,Керамика,Фрагмент,Изразца красноглиняного с белой поливой фр-т
dataset/Нц-45-1466_orig.jpg,Нц-45-1466,Изразец,Керамика,Фрагмент,Изразца красноглиняного со следами темной поливы фр-т
